{
  "$schema": "https://json-schema.org/draft/2020-12/schema",
  "$id": "https://qav2.io/skein/schemas/character.schema.json",
  "title": "Character",
  "description": "A carrier of threads. Stable roster entry; alignment/faction can shift via arc, but the character id is stable.",
  "type": "object",
  "additionalProperties": false,
  "required": ["id", "name"],
  "properties": {
    "id": {
      "type": "string",
      "pattern": "^[a-z0-9-]+$",
      "description": "Stable character id, e.g. 'cody-rhodes', 'dom-mysterio'."
    },
    "name": {
      "type": "string",
      "description": "Display name."
    },
    "alignment": {
      "type": "string",
      "enum": ["babyface", "heel", "tweener", "unknown"],
      "description": "Current alignment. Snapshots; revise when the character turns."
    },
    "faction": {
      "type": ["string", "null"],
      "description": "Faction id or null. References factions if faction registry added later."
    },
    "brand": {
      "type": "string",
      "enum": ["Raw", "SmackDown", "NXT", "free-agent", "released", "offscreen"],
      "description": "Roster placement."
    },
    "archetype": {
      "type": ["string", "null"],
      "description": "Worked Shoot archetype assignment, e.g. 'Grail', 'Bound-Loki'. Null if not framework-tagged."
    },
    "register": {
      "type": "string",
      "description": "Worked Shoot framework tier (Pantheon, Constant, Liminal-Warrior, etc.)."
    },
    "notes": {
      "type": "string",
      "description": "Free-text context (recent injury, hibernation, registry refinement, etc.)."
    }
  }
}
