[
  {
    "id": "cody-rhodes",
    "name": "Cody Rhodes",
    "alignment": "babyface",
    "faction": null,
    "brand": "SmackDown",
    "archetype": "grail",
    "register": "Pantheon",
    "notes": "Undisputed WWE Champion (3rd reign, 9wks at Backlash). WM42 orbital fracture from Orton punt."
  },
  {
    "id": "roman-reigns",
    "name": "Roman Reigns",
    "alignment": "tweener",
    "faction": "bloodline-original",
    "brand": "Raw",
    "archetype": "patriarch",
    "register": "Pantheon"
  },
  {
    "id": "jacob-fatu",
    "name": "Jacob Fatu",
    "alignment": "tweener",
    "faction": null,
    "brand": "Raw",
    "archetype": "aitu",
    "register": "Pantheon",
    "notes": "Free-agent aitu. Declared for Raw on SD 4/25."
  },
  {
    "id": "seth-rollins",
    "name": "Seth Rollins",
    "alignment": "babyface",
    "faction": null,
    "brand": "Raw",
    "archetype": "bound-loki",
    "register": "Pantheon"
  },
  {
    "id": "bron-breakker",
    "name": "Bron Breakker",
    "alignment": "heel",
    "faction": "vision",
    "brand": "Raw",
    "archetype": "devourer-rising",
    "register": "Pantheon"
  },
  {
    "id": "gunther",
    "name": "Gunther",
    "alignment": "heel",
    "faction": null,
    "brand": "SmackDown",
    "archetype": "career-killer",
    "register": "Pantheon",
    "notes": "Sleeper attack on Cody SD 5/01 opened the Backlash feud."
  },
  {
    "id": "penta",
    "name": "Penta",
    "alignment": "babyface",
    "faction": null,
    "brand": "Raw",
    "archetype": "lucha-warrior",
    "register": "Constant",
    "notes": "IC Champion. Aztec / Tezcatlipoca-jaguar register."
  },
  {
    "id": "becky-lynch",
    "name": "Becky Lynch",
    "alignment": "heel",
    "faction": null,
    "brand": "Raw",
    "archetype": "nemesis",
    "register": "Pantheon",
    "notes": "Women's IC Champion."
  },
  {
    "id": "joe-hendry",
    "name": "Joe Hendry",
    "alignment": "babyface",
    "faction": null,
    "brand": "Raw",
    "archetype": "orphic-bard",
    "register": "Liminal-Warrior"
  },
  {
    "id": "oba-femi",
    "name": "Oba Femi",
    "alignment": "tweener",
    "faction": null,
    "brand": "Raw",
    "archetype": "ascending-orisha",
    "register": "Pantheon"
  },
  {
    "id": "stephanie-vaquer",
    "name": "Stephanie Vaquer",
    "alignment": "babyface",
    "faction": null,
    "brand": "offscreen",
    "archetype": null,
    "register": "Constant",
    "notes": "Legit AC sprain after JD coven ambush 4/27; written off indefinitely."
  },
  {
    "id": "jd-mcdonagh",
    "name": "JD McDonagh",
    "alignment": "heel",
    "faction": "judgment-day",
    "brand": "Raw",
    "archetype": null,
    "register": "Constant"
  },
  {
    "id": "finn-balor",
    "name": "Finn B\u00e1lor",
    "alignment": "tweener",
    "faction": null,
    "brand": "Raw",
    "archetype": "fomorian-exile",
    "register": "Constant",
    "notes": "Hosting 'Club House' since JD ejection."
  },
  {
    "id": "dom-mysterio",
    "name": "Dominik Mysterio",
    "alignment": "heel",
    "faction": "judgment-day",
    "brand": "Raw",
    "archetype": null,
    "register": "Constant"
  },
  {
    "id": "liv-morgan",
    "name": "Liv Morgan",
    "alignment": "heel",
    "faction": "judgment-day",
    "brand": "Raw",
    "archetype": "inanna",
    "register": "Constant",
    "notes": "JD coven leader."
  },
  {
    "id": "roxanne-perez",
    "name": "Roxanne Perez",
    "alignment": "heel",
    "faction": "judgment-day",
    "brand": "Raw",
    "archetype": "jd-apprentice",
    "register": "Constant"
  },
  {
    "id": "raquel-rodriguez",
    "name": "Raquel Rodriguez",
    "alignment": "heel",
    "faction": "judgment-day",
    "brand": "Raw",
    "archetype": "jd-enforcer",
    "register": "Constant"
  },
  {
    "id": "logan-paul",
    "name": "Logan Paul",
    "alignment": "heel",
    "faction": "vision",
    "brand": "Raw",
    "archetype": "false-god-influencer",
    "register": "Pantheon"
  },
  {
    "id": "paul-heyman",
    "name": "Paul Heyman",
    "alignment": "tweener",
    "faction": null,
    "brand": "free-agent",
    "archetype": "wise-man",
    "register": "Constant",
    "notes": "The Constant \u2014 appears across eras, owes favors, advocates for the throne not the man. Cross-brand. Scroll 007 archetype locked SD 5/08."
  },
  {
    "id": "austin-theory",
    "name": "Austin Theory",
    "alignment": "heel",
    "faction": "vision",
    "brand": "Raw",
    "archetype": "disposable",
    "register": "Constant"
  },
  {
    "id": "sol-ruca",
    "name": "Sol Ruca",
    "alignment": "babyface",
    "faction": null,
    "brand": "Raw",
    "archetype": "liminal-warrior",
    "register": "Liminal-Warrior",
    "notes": "Officially Raw roster as of 5/04."
  },
  {
    "id": "adam-pearce",
    "name": "Adam Pearce",
    "alignment": "tweener",
    "faction": null,
    "brand": "Raw",
    "archetype": "gatekeeper-institution",
    "register": "Constant",
    "notes": "On-screen GM (Raw)."
  },
  {
    "id": "nick-aldis",
    "name": "Nick Aldis",
    "alignment": "tweener",
    "faction": null,
    "brand": "SmackDown",
    "archetype": "gatekeeper-institution",
    "register": "Constant",
    "notes": "On-screen GM (SmackDown)."
  },
  {
    "id": "jimmy-uso",
    "name": "Jimmy Uso",
    "alignment": "babyface",
    "faction": "usos",
    "brand": "SmackDown",
    "archetype": null,
    "register": "Pantheon"
  },
  {
    "id": "jey-uso",
    "name": "Jey Uso",
    "alignment": "babyface",
    "faction": "usos",
    "brand": "SmackDown",
    "archetype": null,
    "register": "Pantheon"
  },
  {
    "id": "solo-sikoa",
    "name": "Solo Sikoa",
    "alignment": "heel",
    "faction": "mfts",
    "brand": "SmackDown",
    "archetype": "fallen-chief",
    "register": "Constant",
    "notes": "Faction destroyed SD 4/25; demoted to manager-architect SD 5/08."
  },
  {
    "id": "tama-tonga",
    "name": "Tama Tonga",
    "alignment": "heel",
    "faction": "mfts",
    "brand": "SmackDown",
    "archetype": null,
    "register": "Constant",
    "notes": "Restless within MFTs; took mic from Solo SD 4/25, got superkicked by Fatu."
  },
  {
    "id": "talla-tonga",
    "name": "Talla Tonga",
    "alignment": "heel",
    "faction": "mfts",
    "brand": "SmackDown",
    "archetype": null,
    "register": "Constant",
    "notes": "Hikuleo / Haku's son / Tama's brother."
  },
  {
    "id": "montez-ford",
    "name": "Montez Ford",
    "alignment": "babyface",
    "faction": "street-profits",
    "brand": "Raw",
    "archetype": null,
    "register": "Constant"
  },
  {
    "id": "angelo-dawkins",
    "name": "Angelo Dawkins",
    "alignment": "babyface",
    "faction": "street-profits",
    "brand": "Raw",
    "archetype": null,
    "register": "Constant"
  },
  {
    "id": "bayley",
    "name": "Bayley",
    "alignment": "babyface",
    "faction": null,
    "brand": "Raw",
    "archetype": null,
    "register": "Constant"
  },
  {
    "id": "lyra-valkyria",
    "name": "Lyra Valkyria",
    "alignment": "babyface",
    "faction": null,
    "brand": "Raw",
    "archetype": "badb",
    "register": "Constant",
    "notes": "Morrigan-bifurcation aspect."
  },
  {
    "id": "rhea-ripley",
    "name": "Rhea Ripley",
    "alignment": "babyface",
    "faction": null,
    "brand": "SmackDown",
    "archetype": "macha",
    "register": "Pantheon",
    "notes": "Women's Champion (won from Jade at WM42)."
  },
  {
    "id": "asuka",
    "name": "Asuka",
    "alignment": "heel",
    "faction": null,
    "brand": "Raw",
    "archetype": "onryo",
    "register": "Pantheon",
    "notes": "Register expanded 5/04 \u2014 onry\u014d + senpai-authority."
  },
  {
    "id": "iyo-sky",
    "name": "IYO Sky",
    "alignment": "babyface",
    "faction": null,
    "brand": "Raw",
    "archetype": "bride-who-became-queen",
    "register": "Pantheon"
  },
  {
    "id": "otis",
    "name": "Otis",
    "alignment": "babyface",
    "faction": "alpha-academy",
    "brand": "Raw",
    "archetype": null,
    "register": "Constant"
  },
  {
    "id": "akira-tozawa",
    "name": "Akira Tozawa",
    "alignment": "babyface",
    "faction": "alpha-academy",
    "brand": "Raw",
    "archetype": null,
    "register": "Constant"
  },
  {
    "id": "chad-gable",
    "name": "Chad Gable",
    "alignment": "tweener",
    "faction": "diamond-mine",
    "brand": "Raw",
    "archetype": "og-el-grande-americano",
    "register": "Constant",
    "notes": "OG El Grande Americano \u2014 mask-lineage carrier."
  },
  {
    "id": "ludwig-kaiser",
    "name": "Ludwig Kaiser",
    "alignment": "heel",
    "faction": null,
    "brand": "Raw",
    "archetype": null,
    "register": "Constant",
    "notes": "Imposter El Grande Americano (Kaiser version, since June 2025)."
  },
  {
    "id": "rey-mysterio",
    "name": "Rey Mysterio",
    "alignment": "babyface",
    "faction": null,
    "brand": "Raw",
    "archetype": null,
    "register": "Pantheon",
    "notes": "AAA crossover ally to OG Gable."
  },
  {
    "id": "julius-creed",
    "name": "Julius Creed",
    "alignment": "tweener",
    "faction": "diamond-mine",
    "brand": "Raw",
    "archetype": null,
    "register": "Constant"
  },
  {
    "id": "brutus-creed",
    "name": "Brutus Creed",
    "alignment": "tweener",
    "faction": "diamond-mine",
    "brand": "Raw",
    "archetype": null,
    "register": "Constant"
  },
  {
    "id": "bravo-americano",
    "name": "Bravo Americano",
    "alignment": "heel",
    "faction": "los-americanos",
    "brand": "Raw",
    "archetype": null,
    "register": "Constant"
  },
  {
    "id": "rayo-americano",
    "name": "Rayo Americano",
    "alignment": "heel",
    "faction": "los-americanos",
    "brand": "Raw",
    "archetype": null,
    "register": "Constant"
  },
  {
    "id": "ethan-page",
    "name": "Ethan Page",
    "alignment": "heel",
    "faction": null,
    "brand": "Raw",
    "archetype": null,
    "register": "Constant"
  },
  {